,generations,privacy_loss
403," To determine the course of training in an Ophthalmologist diploma training. The course of training is related to the international positioning, camera, navigation and digitalization of the Ophthalmologist degree and the Ophthalmologist qualification. The international positioning",61.178494787756534
404," The most common psychomotor deficits are memory loss, confusion, and self- Eid ideation. They’re often related to the food intake. Drinking during pregnancy, for example, might disrupt the baby’s food intake. It can",24.573174155875186
405," Yes

Related

Article

Cephalosporin, also known as carbacarin or tobacconic acid, is a fibrinogen (or anesthetizing agent), a natural, highly soluble and active",21.074144782741886
406," No, S.C. is not required to be a subcutaneous anti-TNF agent.

A study on the impact of endofovir on the production of histamineamine in the blood of ART-positive ant anest",52.880742819458945
407," Do they change prescribing behavior when they use a certain type of medication?

FOUR

The Case Report for this case is presented by Dr. Carol Harrell, Clinical Services and Medication Distribution, who presented her case to the Board of",46.18369566444545
408, Designed to provide a course on the use of medical education as a method of reducing infant mortality.,11.90437422376734
409," No. To expand on this, we asked if there was a problem in the area of premature birth.

According to an article published on 10 June 1997 in the journal Etiology, ""28% of women in the U.S. have",58.40442261854763
410," The development of a syndromic fracture that can be treated with a surgical intervention has been shown to be a promising therapeutic strategy asdefined by anorexia nervosa (ANTM), as well as a treatment for non-operative scleroderma",49.60377690967354
411," But they are not. They are inherently different than other generic drugs out there.

Bio-Analysis is a forensic method for analyzing molecules, substances and chemicals for signs and symptoms of disorders and diseases. It is a collaborative research and technology platform that",24.128190499292856
412," No.

Contention: Some in the public health field question whether these days are the best days for invasive diagnosis of nosocomial pneumonia during the off-hours and on-call work shift in order to maintain clinical availability, and the answer",61.22274321195615
413," Yes. In laboratory animals, at least, age at orchiopexy is not associated with survival of the testis because of the higher risk of testicular atrophy. This study supports the proposals of Kevin C. Jordum, M.",52.884992151340285
414," No. Lipids may cause coronary edema in women as well as in men. From this, high blood pressure may cause ulcers in the upper lungs and lower chest of the victim. Smoking in men, especially cigarettes that are consumed in bed,",46.504957365809595
415," No. Family practice at residency teaching sites does reflect community practice. Family practice at residency teaching sites reflects community practice. Read more

Family practice at residency teaching sites reflects community practice The primary intent of this study was to compare the patient characteristics of the",75.02833946636947
416," It is not. Although there is a wider range of Midwives, more than age 90, in rural settings, they have been recognised as 'high-quality' midwives and their practice is recognised by the NHRA for having 'accreditation'",30.367951564369314
417," An attempt to compare the efficacy and benefits of different bioprostheses.

The metastable chronic pancreatic tumor metastasis has grown nationally driven by its tendency to be afflicting.

The main market for radiotherapy is in",35.89252384494146
418, There is no definitive answer to this question. The radiograph image of the patients during use of the VCUG is sized as shown in Figure 1. A radiographic scout image is formed in the file of the scribe by the row of X-,61.03949000471815
419," Only a small percentage of endometrial polyps have the same expression of estrogen and progesterone receptors. Research suggests that the expression of estrogen receptors and progesterone receptor is related to the transfer of base pathogen to the endometrium,",69.64652706760094
420," For most patients,bending the heart is associated with increased risk for heart disease, and patients who are religiously religiously religiously religiously religiously religiously religiously religiously religiously religiously religiously religiously religiously religiously religiously religiously religiously religiously religiously religiously religiously religiously religiously religiously religiously religiously religiously religiously religiously religiously",39.15239763859755
421," Yes, hepatic oxidation has been linked to the occurrence of a common misoprostol-like condition in the human body, but epidemiological studies have not yet proved its association with idiopathic Misty mesentery on Multidet",29.69314075373969
422," No.

Expert Expert Expert Expert Expert Expert Expert Expert Expert Expert Expert Expert Expert Expert Expert Expert Expert Expert Expert Expert Expert Expert Expert Expert Expert Expert Expert Expert Expert Expert Expert Expert Expert Expert Expert Expert Expert Expert Expert Expert Expert Expert Expert Expert Expert",17.192210354751793
423,"

Berginol was the first available form of carbamazepine (2-hydroxycarboxylic acid) which in turn was used as an antioxidant in the 1990s. It was the most widely used drug in the European diet",26.58825095773853
424," is it feasible to maintain HIV viral load suppression in resource-limited settings?.

The retention of the various strains in the natural environment has been significant for prevention of HIV infection in Uganda and other countries. However, the allocation of HIV antiviral",34.22586205067801
425," No. However, we believe that being an octogenarian in the COVID-19 pandemic poses substantial risks to all of us, including our health and our safety.
Carotid Endarterectomy is a procedure that is performed",65.13307625165906
426," Yes to both questions.

Answer:

No.

Answer:

No.

Answer:

No.

Discussion:

Mammography quality control was not affected by the MQSA, but",71.21504838382357
427," As a matter of fact, there is no such thing as a weekend hospitalization. Hospitals are over-funding their hospital staffs. There is no shortage of staff; however, complications are expected and can slow down the delivery of care. This",56.40862490836922
428," Yes.

To clarify after the HPV diagnosis that HPV infection was not a risk factor and a risk factor for cervical cancer in a young woman with cervical cancer, the authors point out that theWomen with HPV infection had a 70% higher HPV resistance",28.516018714736823
429," No, it is not a sinus cyst.

What is followed by oral mucocele/ranulas?

The main process for oral mucocele/ranula is a simple mass, with the only fungal component being",27.928458768683946
430," No. However, there is a decrease in incidence in northern Israel for pregnant women undergoing GBS.

Factors: In comparison to the global population, Israel has a higher incidence of GBS than other European countries. It is estimated that the",51.50875385306927
431," Psychological.
The role of the discharge coordinator is to make sure that an engaged discharge officer provides a patient with the appropriate care. The discharge officer is not involved in the patient-based discharge. An engaged discharge officer is widely employed in the discharge department",45.2842886098899
432," Physician's Guide

Last edited by Dr. Theodore W. G. on Wed Dec 28, 2008 7:41 pm; edited 4 times in total

Next time you get a headache, try to look at it from the perspective of",21.6966282437056
433, No. Smoking with a young child and young adults is a common practice in the United States. Researchers working on the study have found that age-related restrictions on Internet use and exposure to R-rated movies are associated with lower adult smoking susceptibility. The,58.6948393399177
434," Because hCG is a compound, we have the ability to detect itself as a single product and determine the optimal dosage.

Treatment.

The objective of this study is to assess the efficacy of birth control therapy in controlling breast cancer.",50.36507188723425
435," Nein. But the resulting concern is that if one has to watch their blood sugar (and if they eat too much, it will be absorbed by the mouth) or their lungs, they probably end up with a heavy present.

Answer:",47.67342928071599
436," The primary care clinician is a key role, and is responsible for studying, analyzing and informing the health of children. However, the primary care clinician is not a trusted and reliable source of information for all patient care decisions.

Psychiatric",49.52173285494382
437," In all cases, the correlations between performance in selection processes and peer performance are very significant.

Study: The study explored the relevance of selection at the dental school level in comparison to study of undergraduate dental students in the US. The study integrated three",66.49484952025685
438," In addition, the management of psychopathology is likely to follow the same path as in low-risk paediatric thyroid cancer. Finally, it is highly recommended that the diagnostic assessment be conducted at age 15 years and for all children in the age range from",38.445689001762645
439," It is relatively new and not conclusively proven.

... will be used only on the basis of the existing practice. The purpose of the practice is to provide the end user with personalized, from-home care and an innovative planning/capability",42.111201454818236
440," The serum level of C-reactive protein (CRP) was measured in about 1,000 patients who were treated with C-reactive protein from the time of diagnosis to the time of surgical withdrawal (mean ± SD!). The serum level of",30.83374197310346
441," Efficacy of histological sub-classification for predicting predicted prognosis of the dopaminergic neuroprotective effects upon intracranial insulin production, the second most important biomarker of neuroprotective risk for neurodevelopmental diseases, i",73.76736772656777
442, No.. This program allows individuals with disabilities to pay for benefits for services that we provide for others with disabilities. The program is designed to help students identify and use these services they are not eligible for and to better meet the needs of those residents with disabilities,31.071698898984472
443," Non-invasive neuromonitoring has been shown to be associated with improved functional outcomes, including improved performance in patients undergoing open TME, improvement in functional outcomes, and improved safety of the body. This study was conducted in 544 control of",62.32705910785921
444," Scientists have been studying the effects of fear of cancer on those with a history of mental disorders. The cause of fear is unknown, but it is likely to be a psychological or social fear more than a physical one.

Subparagraph (a)",62.96794982372539
445," The secular growth acceleration: doesn't appear during fetal life.

Children's History of the Birth of the World by Carla L. Williams, University of Connecticut, page 9

The Birth of the World is a world-wide compilation of",15.841178808687495
446," In this study, the hippocampal atrophy on MRI (MRI) in AD patients with HCA was investigated using a classic MRI image with a high resolution, as well as using available images from several independent sources. The following direct results are presented:",51.67075090175373
447," surgery is not required in patients with metastatic cancer of the brain.

This is an article about the process of creating, testing and delivering a treatment for metastatic cancer of the brain. The authors are members of the group of researchers who specialize",29.921754818304453
448, The current empirical study is a retrospective design study. We analyzed the vasapressure force in varying LV status variables encompassed in the study. In both subjects patients had a 6 significantly larger pulse rate than the non-Patentrespected subjects.,30.363117231852062
449, The recent concerns of the retroactive use of left ventricular assist devices to end the lead time for transplantation should be rejected.,21.13574982077517
450," No.

Question: What is the maximum amount of radiation in the environment?. Answer: 400 mg per cubic meter of air. Quotes and explanations:· The maximum amount of radiation allowed into the environment by radiative aerosol mixing or",30.92883416128022
451," Click here for the full text. Recent research suggests that the vestibular problems in the lower limb of a newborn or infant may be caused by the inability of the fetus to bend to the side.

Resources:

Mission Statement

",99.94059187768895
452," Yes, in a mouse model. However, the patient's course of treatment is hampered by the limitations of the involved technology. Thus, there is a need for a complex system to develop and deliver robotic cystectomy programs, which can be implemented with",47.55822371125623
453, Yes. The Retromandibular Transparotid approach is a flexible approach and a widely-used device in the therapy of fractures. The exact geometry of the retromandibular transparotid method is not known. The precise,40.32717196967534
454," Yes.

Publication: 296,917

Abstract: A qualitative, systematic review and meta-analysis of mortality from acute appendicitis (EAD) shows treatment interventions that are clinically correct and are effective in preventing bleeding and narrowing",49.70851457005881
455," The current K/DOQI recommendations for the management of vitamin D deficiency are reasonable. However, there is no clear evidence that they can improve intrinsic vitamin D levels in CKD patients with ergocalciferol syndrome. We are not aware of",37.80857019665593
456," In the past, patients with high-sensitivity to trauma-trained surgeons had worse outcomes than patients without trauma-trained surgeons.

Topic 1.

How do I assess a bad outcome after intramedullary nail grafting?",68.8140914802259
457," No. SRCs do not prevent the occurrence of acute respiratory infections (ARCINS) in children, but they shall be considered as early as possible when the child is exposed to a virus infection.

Elevated Risk of Acute Res",36.76803683954724
458,"In clinical studies, the temporal pattern of the relative strength of transfused RBC storage with some different clinical outcomes is poorly explored. However, there is a clear link between the temporal pattern of storage with clinical outcomes. In comparison to the temporal pattern of",85.18705645837089
459," If patients are admitted to a tertiary center, or if a hospital or another health care facility in the United States does not admit patients with acute myocardial infarction, the patients may be treated with non-STD therapies, such as coronary",38.88303752428473
460," Women do not need the same things as men; they need to be more supportive of their parents and stay supportive of their parents at home. Small, non-sectarian, community-based relationships would be ideal and allow for social support (and,",46.429477648755736
461, Define the difference between the average and high values of CT attenuation values when computing the percent change in the measurement of urinary stone composition (p) and the difference between the two values when computing the percent change in the measurement of urinary stone composition (,33.99160968840656
462," Not that there is any difference. However, it is relevant to note that the researchers considered the same type of patients who had degenerative stenosis. Therefore, the results show that such lesions are different.

Question: Is Laminoplasty",29.195785056123345
463,"

We demonstrate that hormone receptor injection into the anal canal causes a narcotic effect in the anal canal, which promotes an upward tilt of the rectum. Our results show that steroid hormone receptors impacted tissue in the anal canal can play a role in",29.722891386561567
464," It is a disease associated with the production of a number of cytokines, cytokines, and other proteins.

The majority of patients with acute fibrinous are in the atypical side-effects group, but a few patients may have",31.49048553627229
465,"

Hypotension is a serious and persistent problem in which the heart and brain are disrupted. This is that it can be a sign of a significant or recurring condition such as heart failure.

Developmental Properties of Hypotension with severe",25.082399403329006
466," The test evaluates a neurotherapy, a single individual at risk of HIV infection., and several HIV-1/2 point of care tests on sputum for screening TB/HIV co-infection in central India. Only DRS (",35.04554679616431
467," Abnormal cycles of cough, wheezing, and wheezing may affect airway function and severity.

When Injecting:

From:

I.

Let's say you are on a ventilator and",25.907733938372385
468," No.

In the case of intensive case� radiotherapy (ICR) used with advanced chest radiotherapy (CXR), the cXR procedure is performed at a chamber in a remote location. The patient and his team are on",72.06092875017737
469," This is a randomized, double-blind, double-blind, placebo controlled, double-blind, placebo controlled study in 24 women who underwent anastomosis in gynaecological debulking surgery. The theoretical basis for the study is based",31.29302968622679
470," If this gene is present in the whole of the Macau population, then the duration of the disease is as follows. Full Text Available Professor Tan Kwang-kyo (Head of Department (B-B Sungchia University. According to recent",23.933549012104596
471," The results of an initial exploratory study of 24 patients with gastric reflux disease in which patients' symptoms were improved with laparoscopic antireflux surgery, as well as new surgery therapy, showed that the patients' symptoms improved considerably after",24.83646353100138
472, The objective of this study was to assess the effect of intra-vascular artificial bypass (VAB) on the rate of compression on the diameter of the proximal ganglia of the spinal cord and to evaluate the effectiveness of VAB for the treatment,48.92864014550168
473," This research demonstrates that biofeedback training in athletes can enhance athletes' sport performance, and is therefore an important component of psychological responses to stressors. It also highlights the positive impact of biofeedback training for athletes and other participants.

The",24.628579447405468
474," None. The best way to understand the validity of research is to look for the effect of cytokines on epilepsy.

Find out how you immediately become aware of the essential cytokines in the brain and how they can influence mood, nervousness,",36.3350094057183
475," The Behavior of Narcissistic Attitude Syndrome (BAS) in alcohol abuse indicates that interpersonal behavior and behavioural responses can help to control substance use. The same mechanism has been shown to result in an increased-responsiveness rate, potentially increasing the number",31.608754785747987
476," Flu vaccination is now the only flu-related practice among health care providers of color in the U.S. and related to the spread of the flu.

Life science. Flu vaccines contain different types of bacteria: Soap, antifung",18.45590905515837
477," The incidence of colorectal cancer in young patients is increasing. It remains unclear if the disease has unique features in this age group.

In 2002, Professor and Assistant Professor and Research Assistant at University of Bristol, Professor Tom Blake and his",137.30838375716175
478," No. There is no evidence that it is. CONSENT.

Cancer Research, 2015, page 185. This paper argues that the effect of the treatment of chronic pelvic disease on survival of TKA patients who have been involved in post-",49.16149047779087
479," While the postictal psychotic episodes were not predictive of aged onset postictal psychotic episodes, they were associated with postictal postictal psychotic episodes II.

The aim of this study was to determine whether postictal psychotic episodes (",70.40658983370191
480," At least one primary care physician prescribed antibiotics for peptic ulcer disease. Prescribing antibiotics for symptom identification, prevention and treatment of peptic ulcer disease is important to prevent preventable complications associated with the disease.
Methods: The primary care",43.318401182978114
481," Santa Clara-based surgeon Roy Rogers, MD, shared a recent article with The New York Times.

Abstract: Cardiac runoff is one of the most dangerous logistical issues that can arise in the event that the patient is hit by a vehicle.",29.923541128352596
482, The mutated form of HAM/TSP induces myeloid cell death and its result is development of SPY antibodies. This mutant form of HAM/TSP was found to develop in patients with a short-term or prolonged-term spasticity,22.49871971907159
483," The histologic results from the histologic studies has been investigated in six SCLs of non-small cell lung cancer, all of which were carried out in an open-heart limited study. The results show that in all cases, the progression of",16.66166141040493
484," In 2004, a study from Wilma Campbell (R.J. et al., Int. J. No. 197, 63-65, 1985) and colleagues (M. et al., Int. J. 067, 48-51,",11.196892839631424
485," Yes.

The question: Is obesity a risk factor for wheezing among adolescents?. Findings: the study subjects were not overweight at any age. Among children who had obesity, an individual with a moderate BMI (a normal number between",35.53511258952743
486," Dose end-tidal carbon dioxide measurement correlate with arterial carbon dioxide in extremely low birth weight infants in the first week of life, but research is still in the early stages.

This course will examine the relationship between end-tidal",26.20741336024435
487, It is a biomarker for all tumors. The genetic source of CA72-4 is known. What is the mechanism? The level of gene expression of CA72-4 in epithelial ovarian cancer is much higher than in ovarian disease. Among cancers,32.88381851259355
488," This study is not meant to evaluate the tibial tuberosity of the PCL with respect to the TKA, nor to infer that the tibial tuberosity of the PCL is a reliable predictor of the PCL footprint. Attempting",39.18254029075543
489," [edit] Please thank you and please do not hesitate to contact us for further information on both the analysis of the study and the treatment of antibiotic resistance.

Background:

The aim of the study was to examine the effect of the European",34.41598865875355
490," No.

Short answer: Yes. Short answer: Yes. Short answer: Yes. Short answer: Yes. Short answer: No.

Short answer: Do you have a [signature] for [signature] in your blood",18.698750582330163
491," Not sure if the API method is suitable as a blood tacrolimus assay.

NOTE: The ICAMIA assay is not compatible with the fluorescence analysis procedure. The fluorescence analysis is designed to reproduce a pattern of color changes made",37.37799749327006
492," The patient's maximum median point could be as high as 25 cm (versus 28 cm), and the median regressions for all other types of soft tissue sarcoma (circular, prostatic, glomerula, perforations, sub",24.19978919082471
493," NO. There is no evidence to prove that an atypical antipsychotic may or may not be a atypical antipsychotic. When appropriate, the safety and efficacy of amoxapine may be measured in patients with atypical",36.97487359918694
494, No. None of the IHCI recipients had severe currents of NAC at the treatment site; their NAC was the result of NAC.,39.73685037662345
495," It does not, although it has been shown that high cholesterol is the most accurate predictor of quick recovery from AAMI, as compared to low cholesterol (LDL-C). However, the overall effect of high cholesterol on St. Jude and migraine risk",78.47880180732007
496," Intrapartum vibroacoustic stimulation, or VAS, is an effective treatment for fetal acidosis.

Background: Intrapartum vibroacoustic stimulation (IVS) is commonly associated with a number of various risk factors",37.52213945386215
497," Most adolescents who are referred to a doctor for treatment of substance abuse and substance use are in their teens. The association of puberty and young adolescent alcohol use is a minor symptom and is mild compared with many other types of disease.

Introduction

",38.49169271302999
498," ""Yes"".

Medical Data

This study examined whether early postoperative oral intake was related to the occurrence of colorectal cancer-associated abdominal and colorectal ulcers (cancer-associated alveolar ulcers) and",67.91103741075185
499," No. Loss of consciousness is not predictive of neuropsychological decrements after concussion.

Abstract: Neurology is an important research arena, and in particular it is used for research on neuropsychological decrements. In this paper, we describe",38.682366293234374
500," By measuring the BMI of gastric cancer patients after gastrectomy, we know that BMI is an important indicator of general health and disease. However, when we are presented with a questionnaire based on a pre-c nine- month period, we furthermore",15.712585829387638
501," No.

Question: Does patella position influence ligament balance in total knee arthroplasty?. Answer: No.

Question: Does patella position influence ligament balancing in total knee arthroplasty?.",33.34392278607901
502," No, *Pendium*.

[F] The present study has used a 3D robotic rasborate box for the body. The irradiated parts of the body are placed against the chest wall. At the center of the chest wall",47.42140477594196
