,generations,privacy_loss
202," Yes, the condition of pelvic ring fractures has been estimated because of the unique type of linkage in the case of this fracture. The type of fracture, of course, depends on the degree of trauma to the pelvic area and the degree of trauma to the",37.62206632089214
203," This is a very complex, disease-related disorder involving accumulating blood glucose and insulin.

Symptoms of celiac disease of patients: Fabry-Molecular Disease: absence of cerebrovascular lesions, amniotic fluid, fluid",34.29723283440938
204," Yes it is increasing, but does this mean that it is growing in other regions in the world?.. Question: What cause is this increase?. Answer: According to the International Organization for Migration, over 90% of the new cases of HIV infection",41.030234991288616
205," cholestasis is a relation between small bowel atresia and the itching on the affected vagina.

Cholestasis is a concern because of the rapid development of small bowel atresia (SBA) and is often attributed to",66.70080626278124
206," Financial incentives can be reviewed and implemented to boost the effectiveness of pregnancy and pregnancy cessation interventions at risk of promotion.

“Some women can access cash-based cash incentives, including a child care allowance, on a ‘wait and see�",38.38422687101118
207," Yes, students have an opportunity to participate in the program. We are currently working on a programme to encourage students to contribute and to contribute towards QA.

Are there any of the following job responsibilities that students may have?:

Uniform",62.97829606514882
208," Listen, try and understand the difference between head and neck paraganglioma, what does head paragangliomas look like, how it is experienced, and with what type of disease. How to measure head paragangliomas.",25.215955200714706
209,"Ultrasonic Leche de noir: Leche sur l’environnement du Canada, dans la cilétricité religieuse et dans la context chéne. A. Dreyfus",21.454963574078846
210," Various techniques have been proposed to develop bone thickness and inter-radicular space in the posterior mandibular sites, with varying degrees of success. In the first phase, we showed that the bone thickness and inter-radicular space are independent of the",33.439854429709044
211," The results of the study indicate that the selection of general practice test scores from trial are significantly more predictive of success at MRCGP. Results: Out of the 40 tertiary-level general practice exams performed in the study, 14% had price range",90.11781917571773
212," The Deformity Angular Ratio (DeGHR) is an analytical method developed by Dr. John Lopate.

Disclosure: I was compensated for this post.

Abstract

A 3-column valve in a thorac",11.488900773459346
213," Yes, accompanied by a lack of communication and interpersonal skills. Reasons for this evidence are described in the section of this paper that follows.

5.1. Proposed model for evaluating relationship between cognitive and behavioral traits in a population with acute dementia",43.913523221723956
214," The growing body of research indicates that oxidative stress is a major factor in uremic plasma oxidation and is linked to the production of autoimmune diseases. In some tomes, such as the Therapeutic Agents for the Treatment of Neurodegenerative Disease",18.832052249241066
215," High-risk HPV infections occur in 62.6% of all samples in which human milk-gene is tested, but are detected in only 31.5% of samples.

Abstract: Immune response to HPV infection can be detected in",36.587448995618225
216," Yes, only if the surgical effort was minimal and the disease was minimal. This study used a DOMS-enhanced birefringent and QC technique (collected in 1992) for a 9-month follow-up. Patients undergoing",32.670819967394294
217, Most of the data in this case are anecdotal and no methodical analysis or analysis of the evidence is proper. Are there any other problems with chemotherapy in advanced non-small cell lung carcinoma?. Answer: The author is not saying that pneumologists,50.04567802318349
218," No.

Other insights:

How to use topical ropivacaine

The most common cause of post-tonsillectomy morbidity in children and pregnant women is common brain hemorrhage, and some of these patients are",30.66941945786337
219," There are currently no studies that suggest that pain is a clinically relevant problem in general adult psychiatry. However, current tools provide some evidence that pain can be a very important risk factor for a psychiatric condition.

Patient's Desired Features and Prevention",32.546626108298476
220," We have performed several studies on ALPERTIN replicating the ALPERTIN knee, abdominal pain, and bladder tightness in DESF/ASY-2, DESF/ASY-1, DESF/ASY-4",32.525273799010506
221," Yes, it does.

Do I Need a Subtle Response? This is a very common question among professionals. There are many advantages and disadvantages to treatment of depression. First, there are numerous studies that show a decrease in antidepressant activity. In contrast",29.761841748101173
222, No. Treatment with a drug that would increase the number of anticoagulations based on anticoagulation are conventional treatments for hemorrhage. We show that the correlation between anticoagulation and the risk of hemorrhage in both patients and ant,93.08030930791698
223," Yes, it is common in the dentists practice of the dentists profession and patients themselves. However, at this stage, some patients may have to be withdrawn from the treatment, because they do not have enough tissue area to successfully use the ure",18.474338979220555
224," No.

METHOD:

Using the ‘Case Study’ information, the enrollees identified a site of care that they could access without incurring a high costs. The regular care enrollees were given a list of preferences, categories",50.946981978106336
225," Knee extensor strength is more important in Parkinson's disease.

Treatment and Development of Symptoms of Parkinson's Disease

Endoscopic Evaluation of Endoscopic Tumors (ETT)

Treatment of Parkinson's disease is a",23.968943315467932
226," No. Last year, the Department of Health and Human Services reported 5,801 applications for Medicaid and 6,967 for Medicare, based on data on the 2015/16 Medicaid filing season.

Beth and Jim Palin/University of",37.5544305246391
227," ""Yes"".

About Attendance:

Like any parent or caregiver, you are responsible for your children's well being, and for the safety of you and your family.

Children do not receive the chance to become adults,",18.60860525943615
228," None.

Inclusion of all francophone health care personnel in Manitoba is a goal of the Manitoba Health and Social Services Commission (HSSC) and the Manitoba National Health Service (MNS).

Only all health care providers in the",37.71195301903006
229," No, only patients with type 1 diabetes mellitus (T1DM) or T1DM with T1DM or T1DM-ICN were found to suffer prolonged Achilles tendon-related pain after a 10 km race. Based on the",84.82790884212397
230," Binding of the esophageal mucosa to the esophageal mucosa is often a sign of primary eosinophilic esophagitis, which is characterized by symptoms of elongated and constricted esophageal mucosa",25.76655021114363
231," The present invention pertains to a cup-cage reconstruction procedure for partially endowments which includes a sport-like bag, a cup-cage and an aforementioned cup. The cup-cage reconstruction procedure includes a ballast, a cup",22.651135841783834
232," If patients are on ventilators, it is legally permissible to use their own artificial ventilation system (the earned-from-hospital system). The question is: is the right ventricular function needed to prevent ventricular death and/or death is too",59.60527189115581
233," Xanthogranulomatous Cholecystitis is the normal form of cholecystitis and is easy to treat, but presents a considerable complication with a case of morbidity and mortality due to complications. This paper first investigates",34.30458499683242
234," No. Although TDP-43 does not confer a distinct pattern of atrophy, it does confer a distinct pattern of abnormal in-vivo filamentation in brain zones with other symptoms associated with a number of other pathological indicators of pathology. TDP",48.042276033435236
235, Yes. The purpose of this study was to test the efficacy of the protocol to assess the safety and effectiveness of the interstitial multicatheter brachytherapy method in an accelerated partial breast radiotherapy (now known as their irl) treatment of,61.53963777692066
236," This is the abstract of the research. The purpose is to find out the relationship between early age bouts with bipolar (and later mental health) and the degree of depression or anxiety associated with bipolar.

Disclaimer: The content of this website is for",37.78403272724955
237," In this paper, we apply a mathematical model to predict the rate of metabolic rate in patients with diabetes, and then manually extract the predicted values from the data. Based on our knowledge and clinical experience we have developed a new method to make prediction of basal",72.2813933804327
238," It is not known, but it is known that a concussion of some sort is caused by collisions. A collapsed helmet, such as an Advisor's helmet, or a pressure filter, will generally prevent a concussion if it is not worn within a reasonable amount",36.94131660347956
239, it is a complex and heterogeneous case involving a ruptured carotid aneurysm. The total effect of spinal subdural hematoma as a whole is negligible. The cumulative effect of the subdural hematoma is 7,54.02774007299634
240," The fluid that is present inside the endocardium during stroke is resumed by circulating the fluid through the vascular tissue, where it may be accelerated by the presence of a secondary tissue. The primary area of consolidation is near the exterior of vascular tissue.
",19.218371710775457
241," The association of motor neuron disease with dementia is an important basis for prevention and treatment of those diseases.

Prognosis: The association between cognitive dysfunction and dementia will be useful for clinicians in deciding whether dementia is a risk factor for cognitive dysfunction.",42.165821856144
242," Examination of the Hospital report. Question: Does solid culture for tuberculosis influence clinical decision making in India?

3. Tom Kaplan, Accreditation of University Hospitals: A comprehensive assessment of CUSIC’s quality of care, to promote",28.466167887293093
243, All single-cut tumor imaging is possible. Figure 1 shows the frequency of echo-planar MR imaging in multiple parotid gland tumors. Blood-derived-injection (DBI) was performed for each tumor group. In the first tumor,20.454706688401167
244,"

The state of a patient with one of the following functions in regard to the hemodynamic periodicity of the blood, and regarding the history of signs, symptoms, and symptoms of the hemodynamic periodicity of the blood.

The patient",79.74681471121613
245," Most likely a change in affective disorder polarity would produce a change in risk factors for suicide.

2. P. C. Kyon

Author:

M. Kovalev

DOI: 10.1079",32.487152290832086
246," No, they don't. It's not a clinic for the past 10 years, it's a clinic for the future. I hope you find it interesting.

Question: What treatments can new or traditional breast cancer patients undergo? Answer: Well",41.23741565721945
247," Yes.

We are investigating the impact of the COVID-19 pandemic on the regularisation of routine checkups and the reduction of all in-office visits and tests performed. We have developed a 50-day-long COVID-",99.99115675236756
248," Initial assessments of disease activity and serious disease activity were carried out on patients located at different locations in the world of practice for the previous year. (Multivariable regression analysis)

The questionnaire consisted of a questionnaire and score written by a patient representative",56.41091396382338
249," The high PSA level is useful to evaluate the patient's disease and to prevent cancer risk.

Positive PSA levels are not declared on a yearly basis but can be determined from the following criteria: (a) the average PSA level",62.99048895054682
250," ""A very large number of patients at the University of Illinois at Urbana-Champaign put their patient's life at risk by spending $2,000 (USD 6,474) on a preventative treatment plan.""",63.78782790653048
251," Yes However, chemotherapy, anticoagulant medications, and hormone therapy have no impact on short-term GI symptoms, or healthcare resources.

Treatment for GI problems, such as abdominal pain and diarrhea, is difficult to treat. Effective",25.610897174727718
252," The study was conducted as a controlled controlled trial.

Results: Pulpotomy had a significant effect on saving time in controlling the pulp pressure. The effect of pulpotomy on the ejection rate of the vertebrae in the fusc",75.39925665295438
253, The coronal apex is an apex level of coronal coronal apex that is affected by the movements of the supraclavicular surface. The coronal apex of the anterior coronal apex of the anterior coronal apex of the posterior coronal,4.030933896052074
254," Some studies have suggested that the health of children with cerebral palsy is not evaluated at all.

This summer, the Stockholm Academy of Sciences announced it will be launching the Planet Living project to create a nation-wide strategy that will help prevent and",27.46588400618063
255," Nope. The progress towards implementing these campaigns has not yet been speedy and we have not yet set the target of delivering as many interventions in the next 20 years.

Follow this link to learn more:

Thank You!

You have",52.59634165302637
256," Yes. However, there is no data available on whether the human breast cancer prognosis is related to the genetic genes in the breast cancer genetic gene. This is because the human breast cancer genetic gene is not known to be inherited.

We are",60.86189033633827
257," 1. Nuchal translucency thickness in the first trimester of pregnancy is affected by both placenta and NICU birth defects, compared with a women who has no gdm (nuchal translucency, gdm = 5",35.95034949390443
258,"

Tracking the number of ARPR1A microsatellites from post-prescribing pre-treatment treatment to pre-competence, the researchers found that the number of ARPR1A microsatellites from pre-",50.37236197802736
259, it's an early stage of the tumor and hence may be different from other types of cancers.name: Late stage cancer with at least 5 years of genomic evidence. This study was funded by Surgeon General of the United States and the National Cancer Institute,32.973656534481144
260, No; CPTs are not considered to predict performance in orthopaedic surgery residency. Successful applicants under the Residency Selection Criteria are counted in this study. The study was designed to compare the performance of a certain number of orthop,39.638469160746105
261," Yes.

Beijing, 10 January 2013

A continuous, global, comprehensive, and comprehensive series of studies on the effects of social distancing and prevention, based on the idea that the underlying mechanisms of disease dynamics are very similar, will",38.708525092226445
262," Yes, competition is better and it’s the best way to deal with it.

Question: Does the same thing happen to other professions when they are set up for big business?. Answer: It depends. What do you think about",111.70769558258118
263," Yes.

2.1 Metabolome and Metabolome Type Change

Metabolome Type Change is a common misdiagnosis of patients with dental disorders. Metabolomes and metabolites are mainly used in means of measurement of tooth size",31.010448417880262
264," Ask yourself this: Why did I choose to apply cold knife conization to my original procedure?. You can also see a more detailed description of the procedure below.

Introduction to Therapeutic Healing

For most of us, skin conditions",60.61177844660953
265," In the presence of pectin (2, 6-tetrahydro (7-amino) and 2-amino) pectin (2, 6-tetrahydro (7-amino) and 2",17.448016170026836
266," Often it is not possible to (i) recall the mood from when you were in a relationship; (ii) analyze the consequences of the emotional content. Also: Problems with deciphering the emotional content of a social, one-on-one relationship",46.34288106622164
267," No.

1. In the first case, we show that the ultrasound image is a non-invasive and non-invasive procedure that allows the blood vessel to be detected. In the second case, we show that the ultrasound image is",37.88805541280602
268," no, i.e., it should not be adjusted for body mass index, as it would not be numerically related to prostate cancer.

In a randomized controlled trial, patients with prostate cancer with fewer than 4 years of prostate function had a",43.71847543945586
269," No. Obstructive sleep apnea is the most common form of an acute respiratory infection in adults. Obstructive sleep apnea is characterized by ejection of the lungs out of the airways, which causes a blocked airway. The obstruct",19.671105027594948
270, The hypothesis that the activation of AMPK in ewe cells led to an impacts of the intracerebroventricular injection on the plasma concentrations of melatonin was supported by results from a study of the plasma concentrations of melatonin in ewe individuals,42.88339945351703
271,"Cheltenham, UK. A right hemispherectomy is one of the most common surgical procedures to treat patients with cerebral hemispheric hemispheric hemispheric hemispheric or cerebral hemispheric hemispheric disease. There is a large",42.07432583492317
272," Tumor-induced gender dimorphism refers to the alteration in the expression of immune cells in the body, resulting in a reduction in blood flow to the brain, resulting in an increased susceptibility to blood clotting and brain hemorrhage. Reactions",24.488520633552653
273, Skills and other materials of intravenously administered endovo-doxoxane or prodrugs for the treatment of terminally ill patients have been suggested for the treatment of terminally ill patients. The experimental drug diclofenac was not,35.778876297457515
274," No.

In a new study, researchers at Stanford University have found that nearly 80% of people diagnosed with breast cancer have either completed or partially completed the cancer treatment phase of the cycle. In contrast, approximately three-quarters of those diagnosed with",28.175100028374693
275," Not likely.

Inhambletonia and the catecholamine cycle: The incidence of catecholaminuria and iodination (I) in men with catecholamine-induced vascular dysfunction (CVID) is probably high",27.9711155855942
276, The first question is asked to assess the reliability of the health reasons for an incoming preventive home visit. The second question is asked to assess whether the all-inclusive preventive home visits offered by the municipality would have a significant effect on community health and wellbeing,75.4065336700301
277," Increasing the number of open access articles would increase the impact of scientific articles in intensive care medicine.

Clinical studies by children have consistently demonstrated that the incidence of heart disease, stroke, and other cases of treatment and death has increased substantially over the",77.97699146934407
278," There is no suggestion that the potential for abnormalities in the sympathetic pathway of the pyloric muscle layer has been exploited. This study was conducted at the Institute of Advanced Medicine of the University of Pennsylvania, USA, and was submitted for publication in the entire",34.678384168732904
279," 'Oh, I do'. In this context, doctors have the most important role to play in the completion of research studies aimed at understanding the effectiveness of new drugs. Understanding the clinical trials that support the development of new drugs, and the differences between the",60.58047935396241
280," blood pressure is the predominant cause of back pain.

The risk of chronic low back pain, a common condition in cars and in the general public, has increased significantly in recent years. According to the National Institute of Health, more than 15.",31.568111049815894
281," The evaluation of health care interventions relates to whether the public value safety-related health care interventions are cost-effective or cost-effective.

health care (EH)

Health care is the provision of health care services that a person is required",78.05310673150989
282," N/A.

Mediation: Tension and fracture: The effect of closure is a incomplete, high-frequency, and chronic phenomenon. With closure, a fracture tends to occur more frequently, and is more difficult to treat.

",66.5564742842232
283," A) Only 2% and B) This was not an observational study, but the study carried out in countries that have had health systems (US, UK, Canada) for more than 20 years. The intervention measures were classified broadly. D) Full",31.39416868051622
284," No. It is important to assess the condition of the disease over the next two years.

References",39.81985398594244
285," No. Gluten intolerance is not a true disease and it is not related to gluten. Gluten tolerance is a rare condition that is characterized by a reduced or significant tolerance to gluten. If you are suffering from celiac disease, you should be advised",38.83021425595571
286," If you have COPD before age 74, smoking may be responsible for your overall lower risk of developing it, and consider taking part in the National Cancer Society-led COPD Study. Learn More.

Community-based physical therapy is an intensive",38.24726374595189
287, It is quite useful. The researchers who used Google for the diagnosis of asthma and flu or for the treatment of allergies in animals were asked to evaluate whether they could relate to the diagnosis of flu-like disease. Their results showed that the search engines were,46.77857537304185
288," The question is, why was there no uniformity in the treatment of veterans with PTSD? (A) There is no uniformity in the treatment of Veterans with PTSD; (B) there is no uniformity in the treatment of veterans with PTSD;",56.330356033742625
289," Yes. Some reject and some endorse.

Some doctors, such as Dr John P. Rolle, agree with and prove that their patients have the best physical or mental fitness, whilst others are not. The main connection between Approved Doctors",48.80040574951964
290, Hepatorenal syndrome (HRS) is the functional renal failure associated with advanced cirrhosis and has also been described in fulminant hepatic failure. Without liver transplantation its prognosis is dismal. Our study included patients with type 1,326.3478253268865
291," Themes in cervical exams are dominated by the mechanistic view of the cervical endocrine system, but this view is too complex in practice. We examined cervical vision by studying the duration of cervical sphincter sphincter sphincter",32.30465852738598
292," Yes. Prescription data for children with asthma are non-statistic, and in need of correction.

The results of this analysis were presented at the 2018 Session of Conference on Epidemic Diseases of Children (2014-2016) in Jerusalem",32.678361443034184
293," It does.

See also:

Have you always thought it would be possible to have a child in the womb when you had an incessant, day-to-day drinking problem? We can help you have a child in the womb",27.115682593073323
294," Prove that fenofibrate does have an effect on sleep apnoea.

Reveal the data in this paper: Science Hugger et al. The effects of fenofibrate on sleep apnoea",32.68216930193943
295," The use of functional MRI (fMRI) in the field of consciousness has been described. The study was conducted in the US and UK with several students. Two patients presented with disorders experiencing hallucinations and delusions, and recovered. The results showed that, with",22.566102433144476
296," Nothing is confirmed but it seems like a feasible option.

Question: What are the benefits of a repeat?. Answer: The delivery 1-2 weeks after the implant, when you can immediately see your unborn baby. The nurse cystoscope",61.24422782623867
297," for an existing, moderate- and high-risk population, cardiac evaluation is required before and during beta-blocker therapy.

Effect of beta-blocker-induced bleeding and death in infants and children with congenital heart disease. In infants",49.624324161650044
298," No, we have not observed any association between specialty care and survival of patients with CHF. Surprisingly, we have discovered that the association between specialty care and survival of patients with CHF is shown to be well-regarded. Our results suggest that",76.23308266500895
299," The prognosis at disease onset is limited because of complicated genetic and immunological disorders. The neurobiologists and cardiologists have recommended that the onset and duration be calculated on a genetic basis. However, the pharmacologists have not specified the exact mechanism",21.718204544455933
300," No, however the upward trend in the number of hospitalized patients with ascitis was related to this kind of complication. The most prevalent type of ascitis is cirrhosis, which is treated with nasogastric pump, with multifocal risk factors",30.321689165623646
301, This article is a summary of the findings and conclusions of the study. The findings of this study are summarized in the paper “Risk and benefits of modern maternal mortality management in poor countries with low socioeconomic status“ (P. J. Slate,34.66013235626045
302," In this study, we made the study protocol available in retrospective studies, for which we proceeded for the period of 18 months to classify cervical cancer in cervical cancer, in order to obtain a controlled distribution, to obtain a retrospective analysis.

From the",29.03815111203114
