,generations,privacy_loss
0," (1) No, but PCD does. (2) Cells lose their cells in the pathway of octadeparitins. There is no evidence that kinases play a role in the disease. (3) Cells lose their DNA when transpl",63.55031700017209
1, no.The difference in the two causes of shooting a moving object is counterbalanced by more than 20% in the first cause and 5% in the second. This difference is significant for the visual acuity around the eye area because the visual acuity,74.43643492576918
2," As pediatricity advances, pediatricilepatients need to monitor for fever, dehydration, and infections. Atrial fibrillation is a commonly known complication of urticaria, although it can be treated with antibiotics. A mother's tendency to develop an",29.542278469366387
3," Yes, there is currently no longer any evidence that the transanal pull-through outweighs the long-term results of the transabdominal pull-through.

Possible TLDR:

Transanal pull-throughs",65.12286476812072
4,1. Not one case in the study resembles that of a standard mammogram.2. This study is comparing the effectiveness of an intervention thatHealthcare.com has labeled ‘Call therapy for breast cancer’ with a ‘Call therapy for,48.88844814703595
5, It is safe in community settings in the UK as it is the first time there is a peer reviewed study that has found that enhanced abdominal angiography (EIA) without a balloon is generally effective in improving outcomes. Exogenous DBEB in,52.52504205989011
6, the following are in general view. These are a subset of laparotomy surgical procedures. The cross-sectional views and secondary analyses are taken from the patient and member-affected areas.,28.58486686207378
7," Studies in both non-standing and standing sleep disorders have demonstrated that adjustment is necessary for measuring sleep and energy related problems in the adult. Existing studies have found no difference in the clinical attitude of sleeping disorders included in this study.

Basic information",87.57639889617457
8," In general, these behaviors do not.

This study looked at the relationship between the transplant and LDL-cholesterol level. In addition to elevating LDL-cholesterol levels, eliminating the amount and the time needed to just intake 50 g of",26.090603861056863
9," Yes, the ward-level preparedness was recommended by the Children's Hospital, The New Children's Hospital, Department of Children's Hospital, The College of General Medicine, and the American Academy of Pediatrics. We found that the wards were well equipped,",72.65146222324744
10," No.. ""There was no change in the liberalized police policy"", according to a source. It was during the mass of anti-police action that dramatically increased the security of the police force, following the 1970s and 1980s. The police in",56.349782232451176
11, No. Pharmacokinetic formulations of therapeutic anticoagulation in trauma patients with moderate to severe trauma have recently been developed. Therapeutic anticoagulation has been shown to have beneficial effects in regards to the prevention and treatment of traumatic brain injury,14.730948388202265
12, The present study investigated the heterogeneity of transcriptase and transcriptase expression in the establishment of the new sign marker TC- and transcriptase transposons in the liver-derived liver. Results: The marker TC- and transcriptase transposons were strongly,55.3221423063485
13," The answer depends on the type of medical needs of patients and their families. Health is an interconnected and interrelated system of living.

to promote family history

encouraging family history

encouraging family history giving

disc",53.232108337020385
14," The impact of emergency ultrasound fellowship programs on residents' psychological and physical health is not clear, and research has shown that the effects of fellowship programs on residents' psychological and physical health are numerous.

Access to information and resources in the Emergency Medicine Enterprise",74.78952265784896
15," A New Therapeutic Concept for Opioid Administration.

In this article, I have summarized the clinical, and practical, rationale for the use of a combination of pharmacologic agents in the treatment of breathing. We include a discussion of the",15.729412404209556
16," Currently, there is no evidence to establish that LRT is currently less than 1% of people with the genetic abnormality of a liver, which is not currently considered safe for adults. LRT does not contain any liver toxicity, however it is a",54.838905689990646
17," No.

The issue of vaccination among young adults over age 65 years was raised in a recent study of the covid-19 vaccine, conducted by University of Toronto and the University of Toronto Health System in Canada.

The analysis included data",43.51416924892305
18," Yes.

There is a growing need for a procedure a new generation of retroperitoneoscopy procedures which enhance the health and appearance of patients for whom the retroperitoneatomy is not easily accessible. The need exists for a procedure which",38.91232130733704
19," Graves disease.

Cardiovascular risk in a rural adult West African population: is resting heart rate also relevant?. Answer: Graves disease.

The present study used information about the role of cardiovascuation in complex coronary events (CR",45.40080227631081
20," It can. The multi-level scenario of the situation cannot be reduced without implications for the use of force and in practice, the range of scenarios for each scenario is limited.

The study was conducted by the Israel Project for Strategic Studies, an",46.083788700862385
21," Not with a study, but with data analysis. [2] Complementary evidence must be gathered before a clinical trial is concluded, and it may not be in the best interest of the patient or the studies. For this study we followed the observation",26.56301051718859
22, The decrease in smoking risk was statistically significant with an average increase of 6.2% in the hand-to-hand smoking among infants who had a smoking history [0]. Safety of infants discharged from such NICUs was lower than in control infants who,52.0893559804093
23," An increase in the number of nomograms would predict the potential for BCR.

Question: Do nomograms designed to predict microbiologic biomarkers (e.g., serological markers of BCR) do a better job of predicting endpoints",44.920135025939764
24," Closed.

Abstract:

The mechanism of hormonal dysfunction is often identified as a mediator of the effects of anantimony on oro-facial pain. However, the mechanism of oro-facial pain is unknown. In",22.145758807524505
25," Eye pathology has been investigated for decades in trials of retinal dysfunction. Visual loss has been identified as a function of wavelength of an electroconductive compound produced through the specification of a wavelength of light, which is measured by the absorption of the light",22.04493696468115
26," No. Relative success of epidural analgesia for labor in the sociology of labor varies from time to time, and in general, they represent a relatively small proportion of the data in the literature. In order to improve the general efficacy of epidural analges",23.610340471288524
27, No. The ability [to] assess prognostic information is driven primarily by the strength of the prognostic association between adjuvant chemotherapy and prognostic symptoms observed in the most recently received adjuvant chemotherapy. The significant association between the addition of M,23.69545198363118
28," Yes, it is extremely effective in similar ways.

Question: Can halofantrine be taken orally?. Answer: Yes, it is very effective in similar ways.

Question: Can halofantrine be taken orally as a",41.18304098187415
29," It is. The VO2max at baseline, was at 1:5, but dropped to 1:5 (the following days) after the first layer of serum adipose was discovered. The volume of adipose tissue that was detected was not as",68.60321250072293
30," Hypotherapy, in which pain is caused by oxygen deprivation, is often used in the treatment of patients with chronic conditions, including fibrotic and inflammatory fibrosis.

Patients with or without hyperbaric oxygenation therapy are less likely to",90.96018447704657
31," If the Hawkins sign can predict necrosis in fractures of the neck of the astragalus, then the signs of necrosis can be represented in the shape of an A.

The member of the staff who provided this study group of subjects",48.0790336707061
32," Probably not. If the rotation requirement is still in the original settings, though, there is likely to be a rotation requirement for surgical clerkship during the rotation period.

The road to surgical clerkship is a long one, and it is not",61.40480816310369
33, Acupuncture has proven to be an effective treatment for those with phonotraumatic vocal lesions. We studied the effectiveness of acupuncture for the treatment of phonotraumatic vocal syndrome in patients with phonotraumatic vocal pathology. Treatment of phonotra,67.4320457365418
34," No. However, treatment is still necessary for the entire patient population at the near end of the radiotherapy treatment. The current technology and the external procedures require an increase in the amount of time spent on the patient and an increase in the patients' recovery",27.46828838299734
35," The general practice characteristics of a primary care health service are not affected by the variety of IT innovation projects supported by the UK Government.

The UK government has been criticized in the past for its poor response to the Goodyear case, in which the",45.59796898644186
36," A retrospective cohort study (N=637) in 12,847 healthy patients with different disease, including trigeminal carcinoma, at baseline, in a single-objective, boy-and-girl-patient, single-subject cohort",14.19326562368752
37," Yes. Consistent follow-up recommendations for abnormal Papanicolaou-complete-30-day follow-up and Papanicolaou-complete-40-day follow-up are substantial and highly consistent.

2. Guid",39.422215948687736
38," A new view in the field of aerobiological research on pollen; a new perspective for radioimaging.

In this article, we consider how to reduce the risk of a possible allergic reaction using a variety of tests. Using two different methods",25.51331100190717
39," AGA is a co-op, co-funding initiative for migraine prevention, and is sponsored by National Institute for Wellness Research in association with National Institute for Wellness Research Research.

It is important to note that the study is not an antibody",29.439343357630946
40," Yes there is, as it is not a nearly-uniform curved surface and also can be transferred from a wound to a patient's cornea.

Description

This article describes the healing efficacy of laser keratorefractive surgery in",18.262079063154914
41," Yes, but the rate is very likely to be much higher if radiotherapy is used to treat recurrent rectal cancer before pelvic exenteration. In accordance with the present health condition in women, radiotherapy of primary rectal cancers (or the most",17.53344395791066
42," Yes

Sheimerdinger Laboratory

The Lymphedema House is a laboratory at the Lymphedema Research Institute at the University of Zurich, where researchers discovered the most common symptoms of lymphedema in the late 80s",37.31963826275432
43," Yes

Related documents:

This paper presents the findings from the study of the cause of metastatic CLC in disease, and shows the benefits of global management of cyclic CLC, from colorectal cancer to peripheral carcinoma",67.96276523400209
44," Yes. Often, the presence of motion perception deficits in schizophrenia can cause a patient to become more aware of VR, instead of visually seeing.",18.47823142055535
45," This is the question that has been asked for almost exclusively in the prior art. To ensure that confidentiality and safety, the study participants were assessed using the following procedures: transgastric endoscopic splenectomy: 5x85 mm incision;",40.08100773927564
46," It is. And if it burned your dick I wouldn't blame you. I'm sorry.

I'm sorry to hear you're not having a good time.

I don't know what the fuck is going on with you. I",21.328675666034034
47," No, the message is unclear. Because over time the kidneys may become implanted in elderly recipients in order to preserve their health.

Samuel L. Leiter, MD, a professor of neurology and orthopaedic psychiatry at NYU Lang",30.27370446936551
48," Generally, providers that have a ""patient benefit"" that is less than the claims expense allocation level resulted in lower claims savings compared to HMOs and primary care case management.The study highlights the importance of communication with health insurance administrators (HMOs",41.54958861655514
49, No. This study is not applicable to patients with moderate or severe coronary artery disease.,26.704379666155607
50," No, as most mesocolon invasion is of benefit for gastric cancer staging.

The use of mesocolon in the diagnosis of gastric cancer is believed to be critical in reducing the risk of gastric cancer, and therefore is generally",40.211523301098495
51, Do the media reports not provide enough information about the role of media in the development of Heterotopic Ossification in the fractures of the large and small fracture regions in the episode of the ankle (MEE) of the player. The release,82.61055977843272
52," The IL-10T endpoint continued to improve after treatment with statins and improves upon normal stroke outcome after stroke. The academic version of the study explored the importance of statins in preventing stroke, including the study's large number of clinical efficacy studies.",34.01154140397477
53," No.

Previous research has demonstrated that across the range of delivery and midwife use, ITT and RTS variations affecting number of antenatal interventions affect the effectiveness and quality of antenatal care. However, a key aspect of the practice must",26.727136314845865
54," Sternal fracture in growing children is very rare but very rare. Sternal fracture is a normal, but sometimes associated, fracture that occurs due to abnormal growth in the body. This result is noted with some of the rarer fractures. It is believed",42.06019211427679
55," According to data from a cross-sectional study conducted by the National Breast Cancer Screening Registry (NBSRC), a woman with breast cancer who has breast cancer had a total of two therogens in her blood compared with one therogens in her blood",54.022758203337055
56, IBR and adjuvant chemotherapy can be used to treat women with breast cancer. Patients with breast cancer typically need to be left to stand for several weeks before the tumor is removed from the breast and the tumor is removed by a specialist. An AV,68.79146261563739
57," Yes

11. Turboviruses are a complex set of organisms that form complex populations of virulence, usually virus-like but not always human-like. Turboviruses are one of the most infectious viruses in the world",26.964292660684123
58, PrISM does not predict length of PICU stay at the point of evaluation as well as the extent to which the PICU stays are determined. The SEC was granted a class action lawsuit against PRISM for infringement of its proprietary data protection law,46.92359142701498
59," No. The position of the implant is not dependent upon the prosthetic its location of the implant. In the case of a nephropathy-accidental valve, the position of the implant is dependent upon the geometry of the implant. No different",50.142319675213386
60," Not normally, but often.

A study conducted by the University of California, Los Angeles (UCLA) was published in the journal PNAS. The results of this study have implications for the development, treatment, and prevention of depression, anxiety",45.40884235710837
61," Anthropology, Humanities, and Social Sciences.

Mental state is a state of memory and feeling responsible for the thinking, thinking, and acting which determines your life. Its purpose is to help you to get the job you need from the moment",9.558029814645115
62," No. Cold preparation is a part of the benefits of cold treatment, but it is a different explanation for why it is used to treat a wide range of illnesses. Cold medicine is considered a medication to treat conditions related to the digestive tract. This study",63.045730049088
63," Yes. This program is used to configure a Laryngeal Mask Supreme® based on a manual by a layperson.

Choosing The Stage

Choose your stage.

Choosing a Stage

Choose your stage

",69.07554607316223
64," This method uses a cobalt blue light slit-lamp that offers a better approach to investigating adult lung function. At the same time, it offers a better technique for studying the activities of the adult lung, which is non-cancerous.
",24.21730989415893
65," no, circumcision is not necessary.

Example:

In a sample of 10,000 male adolescents, circumcision was performed in 6 of them, four of which were circumcised. The circumcision resulted in a decrease in the penis circumference and a greater",45.42181083097783
66," Patients who received a colonoscopy in the first two years of their ten-year treatment should get a colonoscopy every three to four months.

Trending Links

A report on past depression in a U.S. pediatric department",30.14568981673311
67," By-electrodes conjugate.

Metabolic activities of daily living affect the normal metabolism of the brain. In some cases, the symptoms of dementia may range from a milder affect to a more severe disease at more advanced stages,",38.02400102767815
68," Does the Simultaneous Use of a Neuroendoscope Influence the Incidence of Ventriculoperitoneal Shunt Infection?.

4. Conclusion

In this study, we analyzed the clinical effects of using a neuroendoscope",52.66776524834618
69," yeah. They see bodies as different from the patient's body and it is a good thing that they do.

Data:

Report: The video shows how physicians and patients perceive body image differently from each other. The body image in video",42.79595108239462
70," No.

Scientists continue to test for the first time whether that knowledge is mediated directly or indirectly in the development of autism or at least that the knowledge of autism can influence important aspects of the child’s development and therefore the development of this",29.67078812229651
71," In the present study, we identified streptococcal-positive M. pneumoniae, streptococcal-negative M. carolinium, streptococcal-negative M. aureus, and streptococcal-positive M",13.22890830518211
72, No. This analysis indicates that if the combination with 2ME is not accurately treated then the 2ME dose can be reduced. Weak and stable combinations of 2ME and other compounds can be used in combination with chemotherapeutically effective such as either,53.65585346056164
73, By analysing joint line positions by means of computed tomography with the intention of assessing joint line positions using images from the lateral surface of the knee. Question: Using a computed tomography imaging method to assess joint line positions by means of computed tomography,60.33875719141109
74," The type of tibial component affects the alignment of the tibial component in the tibial bursa (e.g., the posteriori-convex of the bursa). In short, some tibial component",23.63591694645261
75, The hypothesis suggests that VEGF expression is associated with venous invasion in pT3 renal cell carcinoma and survival in pT3 renal cell carcinoma is associated with significant mortality in pT3 renal cell carcinoma with high venous invasion,44.53826599980756
76," N/A.

Good Samaritan Community Board 03/18/2013

All information provided in this website and on third party websites (including but not limited to: Job ads, newsletters, newspapers, magazines, and websites all owned by",23.56341901539112
77," The standard of care has been to advice the person to take prenatal corticosteroid for about 1 year after the birth of the child.

Example:

A woman may need to take corticosteroids for about 1 year after the",37.0190150719492
78," We found that autotitrating CPAP machines reduced the number of fat cells and cells per colony by roughly 40%. Between 1980 and 2006, autotitrating CPAP machines experienced a historic decrease in fat cell proliferation. While their performance in obese",27.60759933023942
79," No. The clinical presentation of a prior preterm birth predicts risk in a subsequent pregnancy, regardless of the presence of preeclampsia or viral infection.

About the study

The study looked at the patient-specific positive or negative reactions",51.392124816789256
80," It is not. The distance traveled because of the caching is not a factor of the patient's health. Meaning, if the patient is traveling to the US, the patient will be refractory to US coverage until they reach the US.

",91.55727404858868
81,"

Withdrawal from the International Charity Racecourse, we were hoping to see some interest in the potential risk factor for pathological gambling. In discussing this subject, senior researchers from the University of Oxford, Cambridge and University of Cambridge's School of Public",32.15086983867706
82," It is not known if these drugs can achieve a similar effect on T-cell response.

Example of total megalactic immunity from malaria, which was first described in 1957 by Gladstone and Bracco. 6-ethylmethoxyeth",29.706329515760956
83," Not at all.

Summary: Current research has found that induction chemotherapy has a positive effect on the treatment of nasopharyngeal carcinoma. However, induction chemotherapy has a negative impact on the treatment of nasopharyngeal carcinoma",20.120060471897705
84," No. Vaccine delivery tolerances have been studied in neonatal testicular torsion, but the results showed no significant differences in the number of adverse effects. However, vaccine delivery tolerances have been studied in neonatal testicular torsion",17.695433455258904
85," No, because they're not. There's a lot of difference between good and bad decisions. (If you wonder, there's a lot of difference between your right and left eye, I'd say it's pretty typical.)

If you're",20.772741469297326
86," No.

Arthur H. Jones is the University of California, Davis Professor of Nutrition and Nutrition at UC Davis and is currently working on a biologic design to study the protective effects of Sulfasalazine and placebo drug Lipovir.",65.23626672344214
87," Well, true, the food is good for people, but it is harmful to the human beings as well.

Question: How can we prevent the food from causing cancer? Answer: Well, it is difficult. No matter how much we eat",31.51236138552567
88," Tinnitus can be a complex issue, with some patients experiencing aches, pains, and other symptoms associated with tinnitus. The clinical evidence is not strong enough to support the use of surgical or sedation for this condition, and is likely",27.93874275115869
89," Not at all. In a mid-stage study, we found that the inflammatory properties of sputum and anaerobic macromolecules were very different in asthma phenotypes compared with healthy controls. Check out the study results. See below for",44.9242987358724
90," More than one-third of HIV/AIDS patients in Jamaica are unaware of the HIV/AIDS treatment (1974) and treatment (1976, 1979, 1993, 2004, 2008).

Treatment of HIV/STD (1974): Treatment of HIV",24.827053037109067
91," We know that PVL has been associated with very high rates of myeloid leukemia and myelodysplastic syndrome in the UK, and some 30% of patients were diagnosed with the infection, and one study reported that participants tended to develop",58.86675288055797
92, Yes. There are a large number of studies that demonstrate this.,7.371737919609013
93," This is a prospective study of the efficacy and safety of positron emission tomography scanning and the use of positron emission tomography to develop a new cardiac resected image analysis system. In conclusion, positron emission tomography scanning is a promising",49.20756189093584
94," Yes

Question: You are a former test is a positive for Test 1 and a negative for Test 2. If you were to use the test for the complete test, what are the chances of you getting positive for the Test for the complete test",31.183479767476154
95," No, the increase in the cigarette tax increases the cigarette tax. The cigarette tax controls cigarette retail prices to prevent egregious profiteering from commercial tobacco makers, and to prevent producers from generating large amounts of profits for the tobacco industry.

Bibliography",46.6234350592953
96," Yes.

Question: What causes the most abnormal esophagitis in children?. Answer: The most abnormal esophagitis is in the eye. As an example, the case of a diabetic whose esophageal wound and limb",25.211632075351954
97," Hypoglycaemia increases the risk of cardiovascular events. In matters of routine management, hypoglycaemia is strongly associated with cardiovascular disease while hypoglycaemia decreases the risk of cardiovascular events. Conclusions: Hypoglycaemia risks of cardiovascular events",43.9292407356577
98," We provide results of the Radiographic Transition Zone study to improve our understanding of the radiographic transition zone. Because of the radiographic transition zone, patient preference for new diagnostic techniques and the presence of an aganglionous disease is increasing.",48.08184244247505
99," The public should be informed that oral prednisone can significantly reduce the severity of asthma exacerbations. If use of oral prednisone in adult patients is needed for asthma exacerbations, use of dexamethasone will be recommended. The case",25.93555946180832
